{
 "doc_id": "legal:154-2024-ND-CP:dieu-4",
 "kind": "legal_text",
 "title": "Nghị định 154/2024/NĐ-CP, Điều 4",
 "issuer": "Chính phủ",
 "effective_date": "2025-01-10",
 "url": "https://g7.cdnchinhphu.vn/api/download/stream?Url=tm-8mq6BhNw0NbrKRhTDAQWsKg3tuqaY0aWypnY78U6M2BY68Ekp0Gvvr483flbRnQpFDuVk1mmfpRPFNXO-fwIBlQDzZvYsR66wU-H0UyB3fAPTvbS7jIGKVQeg-t20R-nFiLeh1h5LFzrMEN2Sbw~~&file_name=2024_1301+%2b+1302_154-2024-N%c4%90-CP.doc",
 "retrieved_at": "2026-10-10",
 "sha256": "37abbb60ec035337511284974b37a5734a0e9a348cc55b85acd978378e4767b8",
 "procedure_ids": [
  "1.010040"
 ],
 "sections": [
  {
   "heading": "Điều 4. Nơi cư trú của người không có nơi thường trú, nơi tạm trú",
   "text": "1. Người không có nơi thường trú, nơi tạm trú khai báo thông tin về cư trú theo mẫu Tờ khai thay đổi thông tin cư trú và nộp trực tuyến, trực tiếp hoặc qua dịch vụ bưu chính công ích đến cơ quan đăng ký cư trú tại nơi ở hiện tại theo quy định tại Điều 19 Luật Cư trú.\nTrường hợp chưa có thông tin hoặc thông tin không đầy đủ, chính xác trong Cơ sở dữ liệu quốc gia về dân cư, Cơ sở dữ liệu về cư trú thì cơ quan đăng ký cư trú tại nơi ở hiện tại của công dân có trách nhiệm tiếp nhận thông tin, hồ sơ của công dân, kiểm tra, xác minh và thực hiện thu thập, cập nhật thông tin công dân theo quy định của pháp luật.\n2. Trường hợp qua kiểm tra, rà soát, cơ quan đăng ký cư trú phát hiện công dân thuộc trường hợp phải khai báo thông tin về cư trú thì có trách nhiệm hướng dẫn và yêu cầu công dân đó thực hiện việc khai báo. Trong thời hạn 30 ngày, kể từ ngày cơ quan đăng ký cư trú yêu cầu công dân khai báo thông tin về cư trú thì công dân có trách nhiệm thực hiện khai báo theo quy định tại khoản 1 Điều này.\n3. Trường hợp qua kiểm tra, xác minh xác định thông tin về cư trú do công dân đã khai báo, cung cấp nhưng chưa đầy đủ, chính xác hoặc không kiểm tra, xác minh được thông tin về công dân thì cơ quan đăng ký cư trú có văn bản giấy hoặc văn bản điện tử từ chối tiếp nhận khai báo thông tin về cư trú và đề nghị công dân đó khai báo lại để kiểm tra, xác minh theo quy định (trừ trường hợp thông tin khai báo lại đúng với kết quả đã xác minh trước đó). Thời hạn kiểm tra, xác minh lại được tính như thời hạn kiểm tra, xác minh lần đầu.\nQua kiểm tra, xác minh nếu có căn cứ xác định người đến khai báo là công dân Việt Nam và thông tin mà công dân đó khai báo đầy đủ, chính xác thì cơ quan đăng ký cư trú tiến hành thu thập, cập nhật thông tin công dân đó vào Cơ sở dữ liệu quốc gia về dân cư để đề nghị cơ quan quản lý căn cước Bộ Công an xác lập số định danh cá nhân của công dân Việt Nam theo quy định của pháp luật. Cơ quan đăng ký cư trú có trách nhiệm cấp giấy xác nhận thông tin về cư trú khi công dân có nhu cầu.\n4. Nội dung giấy xác nhận thông tin về cư trú bao gồm các thông tin cơ bản về công dân: Họ, chữ đệm và tên, số định danh cá nhân; ngày, tháng, năm sinh; giới tính; quốc tịch; dân tộc; tôn giáo; quê quán; nơi đăng ký khai sinh; nơi ở hiện tại; ngày, tháng, năm khai báo cư trú; họ, chữ đệm và tên chủ hộ; quan hệ với chủ hộ; số định danh cá nhân chủ hộ.\n5. Công dân đã được cấp giấy xác nhận thông tin về cư trú có trách nhiệm đăng ký thường trú hoặc đăng ký tạm trú ngay khi đủ điều kiện, thủ tục theo quy định của Luật Cư trú; trường hợp chưa đủ điều kiện đăng ký thường trú, đăng ký tạm trú nhưng có thay đổi về thông tin cá nhân, thông tin nhân thân thì phải khai báo lại với cơ quan đăng ký cư trú nơi đã cấp giấy xác nhận thông tin về cư trú để kiểm tra, xác minh, rà soát, cập nhật, điều chỉnh thông tin trong Cơ sở dữ liệu quốc gia về dân cư, Cơ sở dữ liệu về cư trú."
  }
 ],
 "jurisdiction": null,
 "link_method": "manual",
 "notes": "relevance: residence of people without permanent/temporary residence. Công báo .doc (congbao.chinhphu.vn/noi-dung-van-ban-so-154-2024-nd-cp-43275). Linked manually: it replaces NĐ 62/2021/NĐ-CP, which the BCA portal pages still cite in legal_basis. Amended by NĐ 58/2026/NĐ-CP (incl. Điều 7, 9, 10; text not held): not merged.",
 "original_version": true,
 "amended_by": [
  "NĐ 58/2026/NĐ-CP"
 ]
}