{
  "doc_id": "legal:123-2015-ND-CP:dieu-38",
  "kind": "legal_text",
  "title": "Nghị định 123/2015/NĐ-CP, Điều 38",
  "issuer": "Chính phủ",
  "effective_date": "2016-01-01",
  "jurisdiction": null,
  "url": "https://media.lamdong.gov.vn/media/5e84f55c-7065-4e34-abf1-da303dc5302e",
  "retrieved_at": "2026-10-10",
  "sha256": "e8bbce073bc0eca5f6c9148ea56f2976c7f0d476fd011d5cdc9da6db8db055de",
  "procedure_ids": [
    "2.000554"
  ],
  "link_method": "legal_basis",
  "original_version": true,
  "amended_by": [
    "87/2020/NĐ-CP",
    "104/2022/NĐ-CP",
    "07/2025/NĐ-CP",
    "120/2025/NĐ-CP"
  ],
  "sections": [
    {
      "heading": "Điều 38. Thẩm quyền ghi chú ly hôn",
      "text": "Thẩm quyền ghi chú ly hôn được xác định theo quy định tại Khoản 2 Điều 48 của Luật Hộ tịch và quy định sau đây:\n1. Ủy ban nhân dân cấp huyện nơi đã đăng ký kết hôn hoặc ghi vào Sổ hộ tịch việc kết hôn trước đây thực hiện ghi chú ly hôn.\nTrường hợp việc kết hôn hoặc ghi chú việc kết hôn trước đây thực hiện tại Sở Tư pháp thì việc ghi chú ly hôn do Ủy ban nhân dân cấp huyện nơi cư trú của công dân Việt Nam thực hiện.\nTrường hợp việc kết hôn trước đây được đăng ký tại Ủy ban nhân dân cấp xã thì việc ghi chú ly hôn do Ủy ban nhân dân cấp huyện cấp trên thực hiện.\nTrường hợp công dân Việt Nam không thường trú tại Việt Nam thì việc ghi chú ly hôn do Ủy ban nhân dân cấp huyện nơi cư trú trước khi xuất cảnh của công dân Việt Nam thực hiện.\n2. Công dân Việt Nam từ nước ngoài về thường trú tại Việt Nam có yêu cầu ghi chú ly hôn mà việc kết hôn trước đây được đăng ký tại cơ quan đại diện hoặc tại cơ quan có thẩm quyền nước ngoài thì việc ghi chú ly hôn do Ủy ban nhân dân cấp huyện nơi công dân Việt Nam thường trú thực hiện.\n3. Công dân Việt Nam cư trú ở nước ngoài có yêu cầu ghi chú ly hôn để kết hôn mới mà việc kết hôn trước đây được đăng ký tại cơ quan đại diện hoặc tại cơ quan có thẩm quyền nước ngoài thì việc ghi chú ly hôn do Ủy ban nhân dân cấp huyện nơi tiếp nhận hồ sơ kết hôn mới thực hiện."
    }
  ],
  "notes": "relevance: ghi vào Sổ hộ tịch việc ly hôn, hủy việc kết hôn đã giải quyết ở nước ngoài; Nghị định 123/2015/NĐ-CP is cited in legal_basis of these procedures (article chosen by topic). Source: văn bản gốc, bản Word do Cổng TTĐT tỉnh Lâm Đồng đăng tải. Hiệu lực/sửa đổi: Văn bản gốc; đã được sửa đổi, bổ sung bởi Nghị định 87/2020/NĐ-CP, 104/2022/NĐ-CP, 07/2025/NĐ-CP và thẩm quyền được phân định lại theo Nghị định 120/2025/NĐ-CP (từ 01/07/2025)."
}
