{
 "doc_id": "legal:26-2023-QH15:dieu-19",
 "kind": "legal_text",
 "title": "Luật Căn cước số 26/2023/QH15, Điều 19",
 "issuer": "Quốc hội",
 "effective_date": "2024-07-01",
 "url": "https://datafiles.chinhphu.vn/cpp/files/vbpq/2024/01/luat26.pdf",
 "retrieved_at": "2026-10-10",
 "sha256": "8dc5ff166e941a70379516d69e3f4798f5ec859735e2e18b8bad86e831401a13",
 "procedure_ids": [
  "1.001247",
  "2.000200",
  "1.012549",
  "1.014062"
 ],
 "sections": [
  {
   "heading": "Điều 19. Người được cấp thẻ căn cước",
   "text": "1. Người được cấp thẻ căn cước là công dân Việt Nam.\n2. Công dân Việt Nam từ đủ 14 tuổi trở lên phải thực hiện thủ tục cấp thẻ\ncăn cước.\n3. Công dân Việt Nam dưới 14 tuổi được cấp thẻ căn cước theo nhu cầu."
  }
 ],
 "jurisdiction": null,
 "link_method": "legal_basis",
 "notes": "relevance: who is issued a card. Công báo text PDF from vanban.chinhphu.vn docid=209628. Original 2023 text; amended by Luật 118/2025/QH15 (in force 01/07/2026; scanned PDF, not merged).",
 "original_version": true,
 "amended_by": [
  "Luật 118/2025/QH15"
 ]
}