{
  "doc_id": "legal:60-2014-QH13:dieu-44",
  "kind": "legal_text",
  "title": "Luật Hộ tịch số 60/2014/QH13, Điều 44",
  "issuer": "Quốc hội",
  "effective_date": "2016-01-01",
  "jurisdiction": null,
  "url": "https://media.lamdong.gov.vn/media/5e84f55c-7065-4e34-abf1-da303dc5302e",
  "retrieved_at": "2026-10-10",
  "sha256": "e8bbce073bc0eca5f6c9148ea56f2976c7f0d476fd011d5cdc9da6db8db055de",
  "procedure_ids": [
    "1.001695",
    "2.000779"
  ],
  "link_method": "legal_basis",
  "original_version": true,
  "amended_by": [
    "120/2025/NĐ-CP"
  ],
  "sections": [
    {
      "heading": "Điều 44. Thủ tục đăng ký nhận cha, mẹ, con",
      "text": "1. Người yêu cầu đăng ký nhận cha, mẹ, con nộp tờ khai theo mẫu quy định và giấy tờ, đồ vật hoặc các chứng cứ khác để chứng minh quan hệ cha con hoặc mẹ con cho cơ quan đăng ký hộ tịch. Trường hợp đăng ký nhận cha, mẹ, con giữa công dân Việt Nam với người nước ngoài hoặc giữa người nước ngoài với nhau thì người nước ngoài phải nộp thêm bản sao hộ chiếu hoặc giấy tờ có giá trị thay hộ chiếu để chứng minh về nhân thân.\n2. Trong thời hạn 15 ngày kể từ ngày nhận đủ giấy tờ theo quy định tại khoản 1 Điều này, công chức làm công tác hộ tịch xác minh, niêm yết việc nhận cha, mẹ, con tại trụ sở Ủy ban nhân dân cấp huyện trong thời gian 07 ngày liên tục, đồng thời gửi văn bản đề nghị Ủy ban nhân dân cấp xã nơi thường trú của người được nhận là cha, mẹ, con niêm yết trong thời gian 07 ngày liên tục tại trụ sở Ủy ban nhân dân cấp xã.\n3. Phòng Tư pháp báo cáo và đề xuất Chủ tịch Ủy ban nhân dân cấp huyện quyết định việc đăng ký nhận cha, mẹ, con, nếu thấy đủ điều kiện thì Chủ tịch Ủy ban nhân dân cấp huyện giải quyết.\n4. Khi đăng ký nhận cha, mẹ, con các bên phải có mặt; công chức làm công tác hộ tịch ghi vào Sổ hộ tịch, cùng các bên ký vào Sổ hộ tịch. Chủ tịch Ủy ban nhân dân cấp huyện cấp trích lục cho các bên."
    }
  ],
  "notes": "relevance: nhận cha, mẹ, con có yếu tố nước ngoài; Luật Hộ tịch số 60/2014/QH13 is cited in legal_basis of these procedures (article chosen by topic). Source: văn bản gốc, bản Word do Cổng TTĐT tỉnh Lâm Đồng đăng tải. Hiệu lực/sửa đổi: Luật đã được sửa đổi, bổ sung; thẩm quyền của UBND cấp huyện trong Luật được phân định lại cho UBND cấp xã từ 01/07/2025 (Nghị định 120/2025/NĐ-CP, Điều 4). Luật Hộ tịch số 03/2026/QH16 thay thế Luật này từ 01/03/2027."
}
