{
  "doc_id": "legal:123-2015-ND-CP:dieu-16",
  "kind": "legal_text",
  "title": "Nghị định 123/2015/NĐ-CP, Điều 16",
  "issuer": "Chính phủ",
  "effective_date": "2016-01-01",
  "jurisdiction": null,
  "url": "https://media.lamdong.gov.vn/media/5e84f55c-7065-4e34-abf1-da303dc5302e",
  "retrieved_at": "2026-10-10",
  "sha256": "e8bbce073bc0eca5f6c9148ea56f2976c7f0d476fd011d5cdc9da6db8db055de",
  "procedure_ids": [
    "1.001193"
  ],
  "link_method": "legal_basis",
  "original_version": true,
  "amended_by": [
    "87/2020/NĐ-CP",
    "104/2022/NĐ-CP",
    "07/2025/NĐ-CP",
    "120/2025/NĐ-CP"
  ],
  "sections": [
    {
      "heading": "Điều 16. Đăng ký khai sinh cho trẻ em sinh ra do mang thai hộ",
      "text": "1. Người yêu cầu đăng ký khai sinh nộp giấy tờ theo quy định tại Khoản 1 Điều 16 của Luật Hộ tịch và văn bản xác nhận của cơ sở y tế đã thực hiện kỹ thuật hỗ trợ sinh sản cho việc mang thai hộ. Phần khai về cha, mẹ của trẻ được xác định theo cặp vợ chồng nhờ mang thai hộ.\n2. Thủ tục đăng ký khai sinh được thực hiện theo quy định tại Khoản 2 Điều 16 của Luật Hộ tịch; nội dung đăng ký khai sinh được xác định theo quy định tại Khoản 1 Điều 4 của Nghị định này."
    }
  ],
  "notes": "relevance: đăng ký khai sinh trong trường hợp đặc biệt (trẻ bị bỏ rơi, chưa xác định cha mẹ, mang thai hộ); Nghị định 123/2015/NĐ-CP is cited in legal_basis of these procedures (article chosen by topic). Source: văn bản gốc, bản Word do Cổng TTĐT tỉnh Lâm Đồng đăng tải. Hiệu lực/sửa đổi: Văn bản gốc; đã được sửa đổi, bổ sung bởi Nghị định 87/2020/NĐ-CP, 104/2022/NĐ-CP, 07/2025/NĐ-CP và thẩm quyền được phân định lại theo Nghị định 120/2025/NĐ-CP (từ 01/07/2025)."
}
