{
 "doc_id": "change:dvcbca:cong-bo-tthc-can-cuoc",
 "kind": "change_notice",
 "title": "Công bố thủ tục hành chính mới lĩnh vực cấp, quản lý căn cước từ 04/7/2024",
 "issuer": "Bộ Công an (dichvucong.bocongan.gov.vn)",
 "effective_date": "2024-07-04",
 "url": "https://dichvucong.bocongan.gov.vn/bocongan/tintuc/chitiet?matin=261",
 "retrieved_at": "2026-10-10",
 "sha256": "78271f70a0f48b14e617eb80a8a739da6c2ca02365385352f0efeb0aa36cc1cc",
 "procedure_ids": [
  "1.012549",
  "1.001247",
  "2.000200",
  "1.000889",
  "2.001195",
  "2.001178"
 ],
 "sections": [
  {
   "heading": "Công bố thủ tục hành chính mới lĩnh vực cấp, quản lý căn cước từ 04/7/2024",
   "text": "Ngày 04/7/2024, Bộ trưởng Bộ Công an ban hành Quyết định số 4864/QĐ-BCA-C06 về việc công bố thủ tục hành chính mới ban hành, được thay thế và bị bãi bỏ trong lĩnh vực cấp, quản lý căn cước. Trong đó ban hành mới 27 thủ tục hành chính, sửa đổi, bổ sung 18 thủ tục hành chính, bãi bỏ 05 thủ tục hành chính.\nMột số thủ tục hành chính cung cấp dịch vụ công trực tuyến như: Cấp thẻ căn cước cho người dưới 14 tuổi, Cấp thẻ căn cước cho người từ đủ 14 tuổi trở lên, Cấp đổi thẻ Căn cước, Xác nhận số chứng minh nhân dân 09 số, số định danh cá nhân ( Nộp hồ sơ tại đây ).\nDanh sách 27 thủ tục hành chính mới ban hành:\nSTT\nMã TTHC\nThủ tục hành chính\n1\n1.012566\nXác nhận số chứng minh nhân dân 09 số, số định danh cá nhân (thực hiện tại cấp xã)\n2\n1.012565\nHủy, xác lập lại số định danh cá nhân (thực hiện tại cấp xã)\n3\n1.012564\nĐiều chỉnh thông tin trong Cơ sở dữ liệu quốc gia về dân cư theo đề nghị của công dân (thực hiện tại cấp xã)\n4\n1.012562\nCấp lại giấy chứng nhận căn cước (thực hiện tại cấp huyện)\n5\n1.012561\nCấp đổi giấy chứng nhận căn cước (thực hiện tại cấp huyện)\n6\n1.012560\nĐiều chỉnh thông tin trong Cơ sở dữ liệu quốc gia về dân cư, Cơ sở dữ liệu căn cước theo đề nghị của người gốc Việt Nam chưa xác định được quốc tịch\n7\n1.012557\nCấp thẻ căn cước cho người dưới 14 tuổi (thực hiện tại cấp huyện)\n8\n1.012556\nTích hợp, cập nhật, điều chỉnh thông tin trên thẻ căn cước (thực hiện tại cấp huyện)\n9\n1.012563\nKhai thác thông tin người gốc Việt Nam chưa xác định được quốc tịch trong Cơ sở dữ liệu quốc gia về dân cư (thực hiện tại cấp xã)\n10\n1.012559\nThu thập, cập nhật thông tin của người gốc Việt Nam chưa xác định được quốc tịch vào Cơ sở dữ liệu quốc gia về dân cư, Cơ sở dữ liệu căn cước và cấp giấy chứng nhận căn cước (thực hiện tại cấp huyện)\n11\n1.012555\nThu thập, cập nhật thông tin sinh trắc học về giọng nói vào Cơ sở dữ liệu về căn cước (thực hiện tại cấp huyện)\n12\n1.012554\nThu thập, cập nhật thông tin sinh trắc học về ADN vào Cơ sở dữ liệu về căn cước (thực hiện tại cấp huyện)\n13\n1.012552\nKhai thác thông tin người gốc Việt Nam chưa xác định được quốc tịch trong Cơ sở dữ liệu quốc gia về dân cư (thực hiện tại cấp huyện)\n14\n1.012553\nKhai thác thông tin người gốc Việt Nam chưa xác định được quốc tịch trong Cơ sở dữ liệu căn cước (thực hiện tại cấp huyện)\n15\n1.012550\nCấp đổi giấy chứng nhận căn cước (thực hiện tại cấp tỉnh)\n16\n1.012547\nThu thập, cập nhật thông tin sinh trắc học về giọng nói vào Cơ sở dữ liệu về căn cước (thực hiện tại cấp tỉnh)\n17\n1.012546\nThu thập, cập nhật thông tin sinh trắc học về ADN vào Cơ sở dữ liệu về căn cước (thực hiện tại cấp tỉnh)\n18\n1.012545\nKhai thác thông tin người gốc Việt Nam chưa xác định được quốc tịch trong Cơ sở dữ liệu căn cước (thực hiện tại cấp tỉnh)\n19\n1.012544\nKhai thác thông tin người gốc Việt Nam chưa xác định được quốc tịch trong Cơ sở dữ liệu quốc gia về dân cư (thực hiện tại cấp tỉnh)\n20\n1.012543\nCấp thẻ căn cước cho người dưới 14 tuổi (thực hiện tại cấp trung ương)\n21\n1.012540\nThu thập, cập nhật thông tin sinh trắc học về ADN vào Cơ sở dữ liệu về căn cước (thực hiện tại cấp trung ương)\n22\n1.012551\nCấp lại giấy chứng nhận căn cước (thực hiện tại cấp tỉnh)\n23\n1.012549\nCấp thẻ căn cước cho người dưới 14 tuổi (thực hiện tại cấp tỉnh)\n24\n1.012548\nTích hợp, cập nhật, điều chỉnh thông tin trên thẻ căn cước (thực hiện tại cấp tỉnh)\n25\n1.012542\nTích hợp, cập nhật, điều chỉnh thông tin trên thẻ căn cước (thực hiện tại cấp trung ương)\n26\n1.012541\nThu thập, cập nhật thông tin sinh trắc học về giọng nói vào Cơ sở dữ liệu về căn cước (thực hiện tại cấp trung ương)\n27\n1.012539\nKhai thác thông tin của người gốc Việt Nam chưa xác định được quốc tịch trong Cơ sở dữ liệu quốc gia về dân cư (thực hiện tại cấp trung ương)\nDanh sách 05 thủ tục hành chính bãi bỏ:\nSTT\nMã TTHC\nThủ tục hành chính\n1\n1.010102\nThông báo số định danh cá nhân (thực hiện tại cấp xã)\n2\n1.010096\nKhai thác thông tin trong Cơ sở dữ liệu Căn cước công dân (thực hiện tại cấp trung ương)\n3\n2.001196\nCấp thẻ Căn cước công dân khi chưa có thông tin trong Cơ sở dữ liệu quốc gia về dân cư (thực hiện tại cấp tỉnh)\n4\n2.001174\nCấp thẻ Căn cước công dân khi chưa có thông tin trong Cơ sở dữ liệu quốc gia về dân cư (thực hiện tại cấp huyện)\n5\n1.000952\nCấp thẻ Căn cước công dân khi chưa có thông tin trong Cơ sở dữ liệu quốc gia về dân cư (thực hiện tại cấp trung ương)"
  }
 ],
 "jurisdiction": null,
 "link_method": "named",
 "notes": "relevance: announcement of new/changed căn cước procedures. Published 2024-07-04. Published before Luật 118/2025/QH15 and TT 116/2026/TT-BCA took effect (01/07/2026): check against current rules. Links: 1.012549 (named): listed by code 1.012549 (cấp thẻ căn cước cho người dưới 14 tuổi, cấp tỉnh); 1.001247 (named): names 'Cấp thẻ căn cước cho người từ đủ 14 tuổi trở lên'; 2.000200 (named): names 'Cấp thẻ căn cước cho người từ đủ 14 tuổi trở lên'; 1.000889 (named): names 'Cấp đổi thẻ Căn cước'; 2.001195 (named): names 'Cấp đổi thẻ Căn cước'; 2.001178 (named): names 'Xác nhận số chứng minh nhân dân 09 số, số định danh cá nhân'. effective_date: notice gives only the date of Quyết định 4864/QĐ-BCA (04/7/2024) = publication date; used as is."
}