{
 "doc_id": "legal:116-2026-TT-BCA:dieu-3",
 "kind": "legal_text",
 "title": "Thông tư 116/2026/TT-BCA, Điều 3",
 "issuer": "Bộ Công an",
 "effective_date": "2026-07-01",
 "url": "https://g7.cdnchinhphu.vn/api/download/stream?Url=tm-8mq6BhNw0NbrKRhTDAaHMpvrqWaeHuYm7lW3HNfzTzww8Myg35dDL_fJB4izwAocLbnFUo4yxVg3b3uH5BHF_k0qUrqPKnSHaKITBO9IXXFX6Vx94bQyIMg7_gCUoTzOIJr3qw7lkObhGM2_EHg~~&file_name=2026_435_116%2f2026%2fTT-BCA.docx",
 "retrieved_at": "2026-10-10",
 "sha256": "d36d84df9d64c3e63a7c9d30fe6fb83c98ca06a024eb3ceeda80ed5a6de48a30",
 "procedure_ids": [
  "1.004222",
  "1.003197",
  "1.004194",
  "1.002755",
  "1.010028",
  "1.003677",
  "1.010038",
  "1.010040",
  "1.010041"
 ],
 "sections": [
  {
   "heading": "Điều 3. Tiếp nhận, giải quyết hồ sơ và thông báo về kết quả giải quyết thủ tục về cư trú",
   "text": "1. Việc tiếp nhận hồ sơ đăng ký cư trú được thực hiện dưới hình thức trực tiếp tại cơ quan đăng ký cư trú hoặc trực tuyến qua Cổng dịch vụ công quốc gia, Ứng dụng định danh quốc gia (VNeID).\n2. Trường hợp nộp hồ sơ trực tiếp tại cơ quan đăng ký cư trú thì công dân cung cấp thông tin gồm: họ, chữ đệm và tên khai sinh, ngày, tháng, năm sinh, số định danh cá nhân, nơi cư trú và những thông tin về điều kiện đăng ký cư trú. Cán bộ tiếp nhận thực hiện tra cứu, khai thác thông tin công dân trong Cơ sở dữ liệu quốc gia về dân cư và cơ sở dữ liệu, hệ thống thông tin có liên quan để tạo lập hồ sơ đăng ký cư trú. Sau khi hoàn tất việc nộp hồ sơ, người có yêu cầu đăng ký cư trú nộp lệ phí đăng ký cư trú theo quy định. Mỗi hồ sơ cấp 01 mã số hồ sơ thủ tục hành chính để người dân theo dõi, tra cứu tiến độ giải quyết hồ sơ.\n3. Trường hợp thực hiện đăng ký cư trú trực tuyến, công dân khai báo thông tin theo biểu mẫu điện tử được cung cấp sẵn và những thông tin, tài liệu về điều kiện đăng ký cư trú; nộp lệ phí thông qua chức năng thanh toán trực tuyến. Sau khi hoàn tất việc nộp hồ sơ, mỗi hồ sơ cấp 01 mã số hồ sơ thủ tục hành chính để theo dõi, tra cứu tiến độ giải quyết hồ sơ.\n4. Trường hợp công dân không tự thực hiện thủ tục về cư trú thì được ủy quyền cho người khác thực hiện thủ tục về cư trú, trừ trường hợp người giám hộ, người đại diện thực hiện thủ tục về cư trú cho người được giám hộ, người được đại diện thì không phải ủy quyền.\n5. Trường hợp thông tin giấy tờ chứng minh điều kiện đăng ký cư trú đã được chia sẻ và khai thác từ cơ sở dữ liệu, hệ thống thông tin hoặc Ứng dụng định danh quốc gia (VNeID) thì cơ quan đăng ký cư trú không được yêu cầu công dân nộp, xuất trình giấy tờ đó để giải quyết đăng ký cư trú.\n6. Trường hợp không khai thác được thông tin trong cơ sở dữ liệu, hệ thống thông tin hoặc Ứng dụng định danh quốc gia (VNeID) thì cơ quan đăng ký cư trú có trách nhiệm kiểm tra, xác minh để giải quyết thủ tục về cư trú. Công dân có trách nhiệm xuất trình bản gốc giấy tờ, tài liệu chứng minh thông tin đã kê khai để cơ quan đăng ký cư trú kiểm tra, đối chiếu và ghi nhận tính chính xác vào biên bản khi thực hiện xác minh.\n7. Trường hợp công dân cung cấp giấy tờ, tài liệu trong hồ sơ đề nghị đăng ký cư trú thì bản quét hoặc bản chụp giấy tờ bằng thiết bị điện tử từ giấy tờ được cấp hợp lệ còn giá trị sử dụng phải bảo đảm rõ nét, đầy đủ, toàn vẹn về nội dung; đã được hợp pháp hóa lãnh sự, dịch sang tiếng Việt theo quy định nếu là giấy tờ do cơ quan có thẩm quyền nước ngoài cấp trừ trường hợp được miễn hợp pháp hóa lãnh sự.\n8. Việc thông báo về kết quả giải quyết thủ tục về cư trú được thực hiện dưới hình thức văn bản giấy, văn bản điện tử, tin nhắn SMS, thông báo qua Ứng dụng định danh quốc gia (VNeID).\n9. Cơ quan đăng ký cư trú có quyền từ chối giải quyết thủ tục về cư trú và không hoàn trả lại lệ phí đối với trường hợp đã nộp lệ phí nếu phát hiện thông tin công dân kê khai không đúng sự thật hoặc giấy tờ, tài liệu công dân đã cung cấp để thực hiện thủ tục về cư trú bị tẩy xóa, sửa chữa, làm giả."
  }
 ],
 "jurisdiction": null,
 "link_method": "legal_basis",
 "notes": "relevance: receiving and deciding residence dossiers, notifying results. Công báo .docx (congbao.chinhphu.vn/van-ban/thong-tu-so-116-2026-tt-bca-470078/67091.htm). Current detailed rules for Luật Cư trú as amended by Luật 118/2025/QH15; from 01/07/2026 it repeals TT 55/2021, 56/2021, 66/2023 (Điều 27). Linked via the legal_basis entry TT 55/2021, which it replaces."
}