{
  "doc_id": "change:xdcs:nd301-2026-lien-thong-khai-sinh-duoi-6-tuoi",
  "kind": "change_notice",
  "title": "QUY ĐỊNH MỚI về đăng ký khai sinh, thường trú, cấp thẻ bảo hiểm y tế cho trẻ em dưới 6 tuổi từ tháng 9/2026",
  "issuer": "Cổng TTĐT Chính phủ – Chính sách và cuộc sống (xaydungchinhsach.chinhphu.vn)",
  "effective_date": "2026-09-01",
  "jurisdiction": null,
  "url": "https://xaydungchinhsach.chinhphu.vn/quy-dinh-moi-ve-dang-ky-khai-sinh-thuong-tru-cap-the-bao-hiem-y-te-cho-tre-em-duoi-6-tuoi-tu-thang-9-2026-119260901170341732.htm",
  "retrieved_at": "2026-10-10",
  "sha256": "7ba970794ae1768c6736a4ac4409a8dffab0df2d842714d0bd493c5f6dcadca1",
  "procedure_ids": [
    "1.001193"
  ],
  "link_method": "manual",
  "sections": [
    {
      "heading": "QUY ĐỊNH MỚI về đăng ký khai sinh, thường trú, cấp thẻ bảo hiểm y tế cho trẻ em dưới 6 tuổi từ tháng 9/2026",
      "text": "(Chinhphu.vn) - Tại Nghị định số 301/2026/NĐ-CP sửa đổi, bổ sung Nghị định số 63/2024/NĐ-CP, Chính phủ quy định việc giải quyết nhóm thủ tục hành chính liên thông \"Đăng ký khai sinh, đăng ký thường trú, cấp thẻ bảo hiểm y tế cho trẻ em dưới 6 tuổi\". Nghị định số 301/2026/NĐ-CP có hiệu lực từ 01/9/2026.\nChính phủ ban hành Nghị định số 301/2026/NĐ-CP, ngày 30/07/2026 sửa đổi, bổ sung một số điều của Nghị định số 63/2024/NĐ-CP ngày 10/6/2024 quy định việc thực hiện liên thông điện tử 02 nhóm thủ tục hành chính: đăng ký khai sinh, đăng ký thường trú, cấp thẻ bảo hiểm y tế cho trẻ em dưới 6 tuổi; đăng ký khai tử, xóa đăng ký thường trú, giải quyết mai táng phí, tử tuất. Nghị định số 301/2026/NĐ-CP có hiệu lực từ 01/9/2026.\nGiải quyết thủ tục “Đăng ký khai sinh, đăng ký thường trú, cấp thẻ bảo hiểm y tế cho trẻ em dưới 6 tuổi” không quá 3 ngày làm việc\nNghị định số 301/2026/NĐ-CP sửa đổi, bổ sung Điều 7, Nghị định số 63/2024/NĐ-CP về tiếp nhận hồ sơ và thời hạn giải quyết thủ tục hành chính: đăng ký khai sinh, đăng ký thường trú, cấp thẻ bảo hiểm y tế cho trẻ em dưới 6 tuổi như sau:"
    },
    {
      "heading": "“Điều 7. Tiếp nhận hồ sơ và thời hạn giải quyết",
      "text": "1. Hệ thống thông tin giải quyết thủ tục hành chính của Bộ Tư pháp tiếp nhận hồ sơ đăng ký khai sinh từ Cổng Dịch vụ công quốc gia.\nThông báo hẹn trả kết quả giải quyết từng thủ tục hành chính trong quy trình liên thông được gửi cho người yêu cầu qua Cổng Dịch vụ công quốc gia hoặc ứng dụng VNeID hoặc gửi tin nhắn điện thoại tự động của Cổng Dịch vụ công quốc gia\".\nQUY ĐỊNH MỚI về chi trả LƯƠNG HƯU, BẢO HIỂM; KHAI SINH, THƯỜNG TRÚ, CẤP THẺ CĂN CƯỚC, XỬ PHẠT HÀNH CHÍNH... có hiệu lực từ tháng 9/2026\nQUY ĐỊNH MỚI về chi trả LƯƠNG HƯU, BẢO HIỂM; KHAI SINH, THƯỜNG TRÚ, CẤP THẺ CĂN CƯỚC, XỬ PHẠT HÀNH CHÍNH... có hiệu lực từ tháng 9/2026"
    },
    {
      "heading": "Chuyển từ \"quản lý thụ động\" sang \"phục vụ chủ động\" với các quy định về đăng ký khai sinh, khai tử chủ động",
      "text": "Chuyển từ \"quản lý thụ động\" sang \"phục vụ chủ động\" với các quy định về đăng ký khai sinh, khai tử chủ động"
    },
    {
      "heading": "Quy định đăng ký khai sinh",
      "text": "Quy định đăng ký khai sinh\n2. Thời gian giải quyết nhóm thủ tục hành chính liên thông “Đăng ký khai sinh, đăng ký thường trú, cấp thẻ bảo hiểm y tế cho trẻ em dưới 6 tuổi ” không quá 03 ngày làm việc kể từ khi các cơ quan có thẩm quyền giải quyết nhận đầy đủ hồ sơ theo quy định, trường hợp phải xác minh thì không quá 05 ngày làm việc.\nNếu tiếp nhận hồ sơ sau 15 giờ thì thời gian được tính bắt đầu từ ngày làm việc tiếp theo.\nTrường hợp người yêu cầu lựa chọn thực hiện thủ tục cấp thẻ căn cước cho trẻ dưới 6 tuổi thì thời hạn giải quyết thủ tục hành chính này không quá 05 ngày làm việc kể từ ngày cơ quan có thẩm quyền nhận được hồ sơ điện tử từ Cổng Dịch vụ công quốc gia.\n3. Trường hợp cơ quan có thẩm quyền giải quyết thủ tục hành chính trễ hẹn thì phải xin lỗi tổ chức, cá nhân bằng văn bản và hẹn lại ngày trả kết quả thông qua Cổng Dịch vụ công quốc gia hoặc ứng dụng VNeID hoặc gửi tin nhắn điện thoại tự động của Cổng Dịch vụ công quốc gia, trong đó nêu rõ lý do chậm trả kết quả và thời gian hẹn lại ngày trả kết quả.\n4. Việc đồng bộ hồ sơ giữa các hệ thống được thực hiện chậm nhất không quá 10 phút ngay sau khi giải quyết xong thủ tục.\nCơ quan giải quyết thủ tục tiếp theo tiếp nhận kết quả, hồ sơ phải phản hồi trạng thái tiếp nhận trong thời gian không quá 2 giờ làm việc kể từ khi nhận được thông tin dữ liệu từ Cổng Dịch vụ công quốc gia.\nTrong trường hợp quá thời gian trên mà chưa nhận được phản hồi thành công hoặc tiếp nhận thông tin có sai lệch trong quá trình đồng bộ dữ liệu giữa các hệ thống thì Cổng Dịch vụ công quốc gia gửi cảnh báo cho hệ thống của các bên liên quan để cán bộ kỹ thuật thực hiện xử lý ngay trong ngày làm việc.\n5. Sau khi Hệ thống đăng ký, quản lý hộ tịch điện tử của Bộ Tư pháp tiếp nhận thành công, Hệ thống thông tin giải quyết thủ tục hành chính của Bộ Tư pháp phản hồi trạng thái và thông tin của hồ sơ đăng ký khai sinh cho Cổng Dịch vụ công quốc gia.”."
    }
  ],
  "notes": "relevance: NĐ 301/2026/NĐ-CP (30/07/2026) sửa đổi NĐ 63/2024/NĐ-CP về liên thông đăng ký khai sinh – thường trú – BHYT cho trẻ dưới 6 tuổi (thời hạn không quá 3 ngày làm việc). effective_date 2026-09-01 theo NĐ 301/2026/NĐ-CP Điều 19 khoản 1 (văn bản gốc PDF datafiles.chinhphu.vn, data/raw/moj/docs/nd-301-2026.pdf)."
}
