{
  "doc_id": "legal:60-2014-QH13:dieu-39",
  "kind": "legal_text",
  "title": "Luật Hộ tịch số 60/2014/QH13, Điều 39",
  "issuer": "Quốc hội",
  "effective_date": "2016-01-01",
  "jurisdiction": null,
  "url": "https://media.lamdong.gov.vn/media/5e84f55c-7065-4e34-abf1-da303dc5302e",
  "retrieved_at": "2026-10-10",
  "sha256": "e8bbce073bc0eca5f6c9148ea56f2976c7f0d476fd011d5cdc9da6db8db055de",
  "procedure_ids": [
    "1.001669"
  ],
  "link_method": "legal_basis",
  "original_version": true,
  "amended_by": [
    "120/2025/NĐ-CP"
  ],
  "sections": [
    {
      "heading": "Điều 39. Thẩm quyền đăng ký giám hộ, chấm dứt giám hộ",
      "text": "Ủy ban nhân dân cấp huyện nơi cư trú của người được giám hộ hoặc người giám hộ thực hiện đăng ký giám hộ giữa công dân Việt Nam và người nước ngoài cùng cư trú tại Việt Nam.\nỦy ban nhân dân cấp huyện nơi đã đăng ký giám hộ thực hiện đăng ký chấm dứt giám hộ."
    }
  ],
  "notes": "relevance: đăng ký giám hộ có yếu tố nước ngoài; Luật Hộ tịch số 60/2014/QH13 is cited in legal_basis of these procedures (article chosen by topic). Source: văn bản gốc, bản Word do Cổng TTĐT tỉnh Lâm Đồng đăng tải. Hiệu lực/sửa đổi: Luật đã được sửa đổi, bổ sung; thẩm quyền của UBND cấp huyện trong Luật được phân định lại cho UBND cấp xã từ 01/07/2025 (Nghị định 120/2025/NĐ-CP, Điều 4). Luật Hộ tịch số 03/2026/QH16 thay thế Luật này từ 01/03/2027."
}
