{
  "doc_id": "legal:123-2015-ND-CP:dieu-40",
  "kind": "legal_text",
  "title": "Nghị định 123/2015/NĐ-CP, Điều 40",
  "issuer": "Chính phủ",
  "effective_date": "2016-01-01",
  "jurisdiction": null,
  "url": "https://media.lamdong.gov.vn/media/5e84f55c-7065-4e34-abf1-da303dc5302e",
  "retrieved_at": "2026-10-10",
  "sha256": "e8bbce073bc0eca5f6c9148ea56f2976c7f0d476fd011d5cdc9da6db8db055de",
  "procedure_ids": [
    "2.000497",
    "2.000513",
    "2.000522"
  ],
  "link_method": "legal_basis",
  "original_version": true,
  "amended_by": [
    "87/2020/NĐ-CP",
    "104/2022/NĐ-CP",
    "07/2025/NĐ-CP",
    "120/2025/NĐ-CP"
  ],
  "sections": [
    {
      "heading": "Điều 40. Điều kiện đăng ký lại khai sinh, kết hôn, khai tử",
      "text": "1. Việc khai sinh, kết hôn, khai tử của công dân Việt Nam định cư ở nước ngoài hoặc của người nước ngoài đã đăng ký tại cơ quan có thẩm quyền của Việt Nam trước ngày 01 tháng 01 năm 2016 nhưng Sổ hộ tịch và bản chính giấy tờ hộ tịch đều bị mất thì được đăng ký lại.\n2. Việc đăng ký lại khai sinh, kết hôn chỉ được thực hiện nếu người có yêu cầu còn sống tại thời điểm yêu cầu đăng ký lại."
    }
  ],
  "notes": "relevance: đăng ký lại khai sinh, kết hôn, khai tử có yếu tố nước ngoài; Nghị định 123/2015/NĐ-CP is cited in legal_basis of these procedures (article chosen by topic). Source: văn bản gốc, bản Word do Cổng TTĐT tỉnh Lâm Đồng đăng tải. Hiệu lực/sửa đổi: Văn bản gốc; đã được sửa đổi, bổ sung bởi Nghị định 87/2020/NĐ-CP, 104/2022/NĐ-CP, 07/2025/NĐ-CP và thẩm quyền được phân định lại theo Nghị định 120/2025/NĐ-CP (từ 01/07/2025)."
}
