{
  "doc_id": "form:04-2024-TT-BTP:pl5-02-to-khai-dang-ky-ket-hon",
  "kind": "form",
  "title": "Mẫu Tờ khai đăng ký kết hôn (Phụ lục 5, Thông tư 04/2024/TT-BTP)",
  "issuer": "Bộ Tư pháp",
  "effective_date": "2024-06-06",
  "jurisdiction": null,
  "url": "https://g7.cdnchinhphu.vn/api/download/stream?Url=tm-8mq6BhNw0NbrKRhTDAQWsKg3tuqaY0aWypnY78U6M2BY68Ekp0Gvvr483flbRhIoshbSM3VdEUWXXBZwz9zu3KfDTiY5ocHP975ifHg1psDU2Hu1pRraKHbuG6OYGzsjhZQeult9J-F4S1ssx-A~~&file_name=2024_739+%2b+740_04-2024-TT-BTP.doc",
  "retrieved_at": "2026-10-10",
  "sha256": "12aaea1c9d41637f682b635bf6c9c43ce5bda3ffc727925a7c3f7ac8f30dc207",
  "procedure_ids": [
    "1.000094",
    "1.000593",
    "1.000894",
    "2.000806"
  ],
  "link_method": "manual",
  "sections": [
    {
      "heading": "TỜ KHAI ĐĂNG KÝ KẾT HÔN",
      "text": "Kính gửi: (3)…\nThông tin\nBên nữ\nBên nam\nHọ, chữ đệm, tên\nNgày, tháng, năm sinh\nDân tộc (4)\nQuốc tịch (4)\nNơi cư trú (4)\nGiấy tờ tùy thân (5)\nKết hôn lần thứ mấy\nChúng tôi cam đoan những lời khai trên đây là đúng sự thật, việc kết hôn của chúng tôi là tự nguyện, không vi phạm quy định của Luật hôn nhân và gia đình Việt Nam.\nChúng tôi chịu hoàn toàn trách nhiệm trước pháp luật về nội dung cam đoan của mình.\nĐề nghị Quý cơ quan đăng ký.\n…, ngày… tháng… năm…\nBên nữ\n(Ký, ghi rõ họ, chữ đệm, tên)\n…\nBên nam\n(Ký, ghi rõ họ, chữ đệm, tên)\n…\nĐề nghị cấp bản sao(6): Có , Không \nSố lượng:… bản"
    },
    {
      "heading": "Chú thích (hướng dẫn ghi Tờ khai)",
      "text": "(1) (2) Trường hợp làm thủ tục đăng ký kết hôn có yếu tố nước ngoài, thì phải dán ảnh của hai bên nam, nữ.\n(3) Ghi rõ tên cơ quan đăng ký kết hôn.\n(4) Chỉ ghi trong trường hợp người có yêu cầu đăng ký hộ tịch chưa có/không cung cấp số định danh cá nhân/căn cước công dân/thẻ căn cước/chứng minh nhân dân.\nTrường hợp phải cung cấp thông tin “Nơi cư trú” thì ghi theo nơi đăng ký thường trú; nếu không có nơi đăng ký thường trú thì ghi theo nơi đăng ký tạm trú; trường hợp không có nơi đăng ký thường trú và nơi đăng ký tạm trú thì ghi theo nơi ở hiện tại.\n(5) Ghi số định danh cá nhân/căn cước công dân/thẻ căn cước (ví dụ: Căn cước công dân số 025188001010 do Cục Cảnh sát QLHC về TTXH cấp ngày 20/11/2021). Trường hợp không có số định danh cá nhân/căn cước công dân/thẻ căn cước thì ghi giấy tờ hợp lệ thay thế (hộ chiếu, chứng minh nhân dân,...).\n(6) Đề nghị đánh dấu X vào ô nếu có yêu cầu cấp bản sao và ghi rõ số lượng."
    }
  ],
  "notes": "relevance: tờ khai số 2 trong Danh mục Phụ lục 5 (Tờ khai đăng ký hộ tịch được đăng tải trên Cổng TTĐT Bộ Tư pháp, người dân tự in) dùng cho các thủ tục này. Nguồn: Công báo (congbao.chinhphu.vn), bản Word. Dấu chấm dẫn dòng được rút gọn thành \"…\". Thay thế Phụ lục Tờ khai của Thông tư 04/2020/TT-BTP từ 06/6/2024; chưa kiểm tra mẫu có bị thay đổi sau 01/07/2025 hay không."
}
