{
  "doc_id": "form:04-2024-TT-BTP:pl5-17-to-khai-dang-ky-viec-thay-doi-cai-chinh-bo-sung-thong-tin-ho-tich-xac-dinh-lai-dan-toc",
  "kind": "form",
  "title": "Mẫu Tờ khai đăng ký việc thay đổi, cải chính, bổ sung thông tin hộ tịch, xác định lại dân tộc (Phụ lục 5, Thông tư 04/2024/TT-BTP)",
  "issuer": "Bộ Tư pháp",
  "effective_date": "2024-06-06",
  "jurisdiction": null,
  "url": "https://g7.cdnchinhphu.vn/api/download/stream?Url=tm-8mq6BhNw0NbrKRhTDAQWsKg3tuqaY0aWypnY78U6M2BY68Ekp0Gvvr483flbRhIoshbSM3VdEUWXXBZwz98pPeuzge-CS0M-g8rqHz4TzJmKltfyp2L4ixYXynMLxfKlHrbuXwdvp726q_M2IZQ~~&file_name=2024_741+%2b+742_04-2024-TT-BTP.doc",
  "retrieved_at": "2026-10-10",
  "sha256": "0c778f6dda73241845ae36152683a67314ce7271e1606207d3003fcf1ab2c52b",
  "procedure_ids": [
    "1.004859",
    "2.000748"
  ],
  "link_method": "manual",
  "sections": [
    {
      "heading": "TỜ KHAI ĐĂNG KÝ VIỆC THAY ĐỔI, CẢI CHÍNH,",
      "text": "BỔ SUNG THÔNG TIN HỘ TỊCH, XÁC ĐỊNH LẠI DÂN TỘC\nKính gửi:(1)\nHọ, chữ đệm, tên người yêu cầu:\nNgày, tháng, năm sinh:\nNơi cư trú:(2)\nGiấy tờ tùy thân:(3)\nQuan hệ với người được thay đổi, cải chính, xác định lại dân tộc, bổ sung thông tin hộ tịch:\nĐề nghị cơ quan đăng ký việc(4)\ncho người có tên dưới đây:\nHọ, chữ đệm, tên:\nNgày, tháng, năm sinh:\nGiới tính:(2)… Dân tộc:(2)… Quốc tịch:(2)\nNơi cư trú:(2)\nGiấy tờ tùy thân:(3)\nĐã đăng ký(5)…\ntại…\nngày… tháng… năm… số:… Quyển số:…\nNội dung:(6)\nLý do:\nTôi cam đoan những nội dung khai trên đây là đúng sự thật và chịu trách nhiệm trước pháp luật về cam đoan của mình.\nĐề nghị cấp bản sao(7): Có , Không ; số lượng:… bản(7).\nLàm tại:… , ngày… tháng… năm…\nNgười yêu cầu\n(Ký, ghi rõ họ, chữ đệm, tên)"
    },
    {
      "heading": "Chú thích (hướng dẫn ghi Tờ khai)",
      "text": "(1) Ghi rõ tên cơ quan đăng ký việc thay đổi, cải chính, bổ sung thông tin hộ tịch, xác định lại dân tộc.\n(2) Chỉ ghi trong trường hợp người có yêu cầu đăng ký hộ tịch chưa có/không cung cấp số định danh cá nhân/căn cước công dân/thẻ căn cước/chứng minh nhân dân.\nTrường hợp phải cung cấp thông tin “Nơi cư trú” thì ghi theo nơi đăng ký thường trú; nếu không có nơi đăng ký thường trú thì ghi theo nơi đăng ký tạm trú; trường hợp không có nơi đăng ký thường trú và nơi đăng ký tạm trú thì ghi theo nơi ở hiện tại.\n(3) Ghi số định danh cá nhân/căn cước công dân/thẻ căn cước (ví dụ: Căn cước công dân số 025188001010 do Cục Cảnh sát QLHC về TTXH cấp ngày 20/11/2021). Trường hợp không có số định danh cá nhân/căn cước công dân/thẻ căn cước thì ghi giấy tờ hợp lệ thay thế (hộ chiếu, chứng minh nhân dân,...).\n(4) Ghi rõ nội dung loại việc đề nghị đăng ký.\nVí dụ: thay đổi họ, tên/cải chính phần khai về chữ đệm của người mẹ/xác định lại dân tộc/bổ sung phần khai về năm sinh của người cha.\n(5) Ghi rõ loại việc hộ tịch đã đăng ký trước đây có liên quan.\nVí dụ: Đã đăng ký khai sinh tại UBND xã Hà Hồi, huyện Thường Tín, thành phố Hà Nội ngày 05 tháng 01 năm 2015, số 10 quyển số 01/2015.\n(6) Ghi rõ nội dung đề nghị thay đổi, cải chính hộ tịch, bổ sung thông hộ tịch, xác định lại dân tộc.\nVí dụ: - Được thay đổi họ từ Nguyễn Văn Nam thành Vũ Văn Nam.\n- Được cải chính năm sinh từ 1975 thành 1976.\n(7) Đề nghị đánh dấu X vào ô nếu có yêu cầu cấp bản sao và ghi rõ số lượng."
    }
  ],
  "notes": "relevance: tờ khai số 17 trong Danh mục Phụ lục 5 (Tờ khai đăng ký hộ tịch được đăng tải trên Cổng TTĐT Bộ Tư pháp, người dân tự in) dùng cho các thủ tục này. Nguồn: Công báo (congbao.chinhphu.vn), bản Word. Dấu chấm dẫn dòng được rút gọn thành \"…\". Thay thế Phụ lục Tờ khai của Thông tư 04/2020/TT-BTP từ 06/6/2024; chưa kiểm tra mẫu có bị thay đổi sau 01/07/2025 hay không."
}
