{
  "doc_id": "legal:04-2020-TT-BTP:dieu-16",
  "kind": "legal_text",
  "title": "Thông tư 04/2020/TT-BTP, Điều 16",
  "issuer": "Bộ Tư pháp",
  "effective_date": "2020-07-16",
  "jurisdiction": null,
  "url": "https://media.lamdong.gov.vn/media/5e84f55c-7065-4e34-abf1-da303dc5302e",
  "retrieved_at": "2026-10-10",
  "sha256": "e8bbce073bc0eca5f6c9148ea56f2976c7f0d476fd011d5cdc9da6db8db055de",
  "procedure_ids": [
    "1.000689",
    "1.001022",
    "1.001695",
    "2.000779"
  ],
  "link_method": "legal_basis",
  "original_version": true,
  "amended_by": [
    "09/2022/TT-BTP",
    "04/2024/TT-BTP",
    "08/2025/TT-BTP"
  ],
  "sections": [
    {
      "heading": "Điều 16. Đăng ký nhận cha, mẹ, con, bổ sung hộ tịch trong một số trường hợp đặc biệt",
      "text": "1. Trường hợp nam, nữ chung sống với nhau như vợ chồng, không đăng ký kết hôn, sinh con, người con sống cùng với người cha, khi người cha làm thủ tục nhận con mà không liên hệ được với người mẹ thì không cần có ý kiến của người mẹ trong Tờ khai đăng ký nhận cha, mẹ, con.\nNếu có Giấy chứng sinh và giấy tờ tuỳ thân của người mẹ thì phần khai về người mẹ được ghi theo Giấy chứng sinh và giấy tờ tuỳ thân của người mẹ. Nếu không có Giấy chứng sinh và giấy tờ tuỳ thân của người mẹ thì ghi theo thông tin do người cha cung cấp; người cha chịu trách nhiệm về thông tin do mình cung cấp.\n2. Trường hợp con do người vợ sinh ra trước thời điểm đăng ký kết hôn, đã được đăng ký khai sinh nhưng không có thông tin về người cha, nay vợ chồng có văn bản thừa nhận là con chung thì không phải làm thủ tục nhận cha, con mà làm thủ tục bổ sung hộ tịch để ghi bổ sung thông tin về người cha trong Sổ đăng ký khai sinh và Giấy khai sinh của người con.\n3. Trường hợp con do người vợ sinh ra trước thời điểm đăng ký kết hôn, chưa được đăng ký khai sinh mà khi đăng ký khai sinh, vợ chồng có văn bản thừa nhận là con chung thì thông tin về người cha được ghi ngay vào Giấy khai sinh của người con mà không phải làm thủ tục đăng ký nhận cha, con.\nTrách nhiệm, hệ quả pháp lý của việc cung cấp thông tin về người mẹ và lập văn bản thừa nhận con chung không đúng sự thật tại khoản 1, khoản 2, khoản 3 Điều này theo quy định tại Điều 5 Thông tư này.\n4. Trường hợp con do người vợ sinh ra hoặc có thai trong thời kỳ hôn nhân nhưng vợ hoặc chồng không thừa nhận là con chung hoặc người khác muốn nhận con thì do Tòa án nhân dân xác định theo quy định pháp luật.\nTrường hợp Tòa án nhân dân từ chối giải quyết thì cơ quan đăng ký hộ tịch tiếp nhận, giải quyết yêu cầu đăng ký khai sinh cho trẻ em chưa xác định được cha hoặc đăng ký nhận cha, con, hồ sơ phải có văn bản từ chối giải quyết của Tòa án và chứng cứ chứng minh quan hệ cha, con theo quy định tại khoản 1 Điều 14 của Thông tư này."
    }
  ],
  "notes": "relevance: nhận cha, mẹ, con: chứng cứ, trường hợp đặc biệt; Thông tư 04/2020/TT-BTP is cited in legal_basis of these procedures (article chosen by topic). Source: văn bản gốc, bản Word do Cổng TTĐT tỉnh Lâm Đồng đăng tải. Hiệu lực/sửa đổi: Văn bản gốc; đã được sửa đổi, bổ sung bởi Thông tư 09/2022/TT-BTP, 04/2024/TT-BTP và Thông tư 08/2025/TT-BTP."
}
