{
  "doc_id": "legal:123-2015-ND-CP:dieu-7",
  "kind": "legal_text",
  "title": "Nghị định 123/2015/NĐ-CP, Điều 7",
  "issuer": "Chính phủ",
  "effective_date": "2016-01-01",
  "jurisdiction": null,
  "url": "https://media.lamdong.gov.vn/media/5e84f55c-7065-4e34-abf1-da303dc5302e",
  "retrieved_at": "2026-10-10",
  "sha256": "e8bbce073bc0eca5f6c9148ea56f2976c7f0d476fd011d5cdc9da6db8db055de",
  "procedure_ids": [
    "1.004859",
    "2.000748"
  ],
  "link_method": "legal_basis",
  "original_version": true,
  "amended_by": [
    "87/2020/NĐ-CP",
    "104/2022/NĐ-CP",
    "07/2025/NĐ-CP",
    "120/2025/NĐ-CP"
  ],
  "sections": [
    {
      "heading": "Điều 7. Điều kiện thay đổi, cải chính hộ tịch",
      "text": "1. Việc thay đổi họ, chữ đệm, tên cho người dưới 18 tuổi theo quy định tại Khoản 1 Điều 26 của Luật Hộ tịch phải có sự đồng ý của cha, mẹ người đó và được thể hiện rõ trong Tờ khai; đối với người từ đủ 9 tuổi trở lên thi còn phải có sự đồng ý của người đó.\n2. Cải chính hộ tịch theo quy định của Luật Hộ tịch là việc chỉnh sửa thông tin cá nhân trong Sổ hộ tịch hoặc trong bản chính giấy tờ hộ tịch và chỉ được thực hiện khi có đủ căn cứ để xác định có sai sót do lỗi của công chức làm công tác hộ tịch hoặc của người yêu cầu đăng ký hộ tịch."
    }
  ],
  "notes": "relevance: điều kiện thay đổi, cải chính hộ tịch; Nghị định 123/2015/NĐ-CP is cited in legal_basis of these procedures (article chosen by topic). Source: văn bản gốc, bản Word do Cổng TTĐT tỉnh Lâm Đồng đăng tải. Hiệu lực/sửa đổi: Văn bản gốc; đã được sửa đổi, bổ sung bởi Nghị định 87/2020/NĐ-CP, 104/2022/NĐ-CP, 07/2025/NĐ-CP và thẩm quyền được phân định lại theo Nghị định 120/2025/NĐ-CP (từ 01/07/2025)."
}
