{
 "retrieved_at": "2026-10-10",
 "link_method": "procedure_code",
 "doc_id": "guide:daklak:hoi-dap-thuong-tru",
 "kind": "guidance",
 "title": "Hỏi đáp: đăng ký thường trú khi thuê nhà",
 "url": "https://dichvucong.daklak.gov.vn/fixture-hoi-dap",
 "sha256": "83ca68be6227af2feb15f227485ed18aff8ecae99416a4bd6df3be1b5e8059b4",
 "procedure_ids": [
  "CT-01"
 ],
 "jurisdiction": "Đắk Lắk",
 "sections": [
  {
   "heading": "Trả lời",
   "text": "Trang chủ > Hỏi đáp\nChia sẻ\nNgười thuê nhà được đăng ký thường trú tại chỗ ở hợp pháp do thuê nếu được chủ nhà đồng ý bằng văn bản.\nTin liên quan\nCách làm căn cước cho trẻ em"
  }
 ]
}
