{
  "doc_id": "form:04-2024-TT-BTP:pl5-20-ban-cam-doan",
  "kind": "form",
  "title": "Mẫu Bản cam đoan (Phụ lục 5, Thông tư 04/2024/TT-BTP)",
  "issuer": "Bộ Tư pháp",
  "effective_date": "2024-06-06",
  "jurisdiction": null,
  "url": "https://g7.cdnchinhphu.vn/api/download/stream?Url=tm-8mq6BhNw0NbrKRhTDAQWsKg3tuqaY0aWypnY78U6M2BY68Ekp0Gvvr483flbRhIoshbSM3VdEUWXXBZwz98pPeuzge-CS0M-g8rqHz4TzJmKltfyp2L4ixYXynMLxfKlHrbuXwdvp726q_M2IZQ~~&file_name=2024_741+%2b+742_04-2024-TT-BTP.doc",
  "retrieved_at": "2026-10-10",
  "sha256": "0c778f6dda73241845ae36152683a67314ce7271e1606207d3003fcf1ab2c52b",
  "procedure_ids": [
    "1.000593",
    "1.000689",
    "1.000894",
    "1.001193",
    "1.003583",
    "1.004746",
    "1.004772",
    "1.004873",
    "1.004884",
    "1.005461"
  ],
  "link_method": "manual",
  "sections": [
    {
      "heading": "BẢN CAM ĐOAN",
      "text": "Kính gửi (1):…\nHọ, chữ đệm, tên:\nNgày, tháng, năm sinh:\nNơi cư trú:\nGiấy tờ tùy thân:\nTôi xin cam đoan nội dung sau đây:\nĐể thực hiện thủ tục:\nTại(1):.\nTôi xin chịu trách nhiệm trước pháp luật về nội dung đã cam đoan nêu trên.\nLàm tại…, ngày … tháng … năm …\nNgười cam đoan\n(Ký và ghi rõ họ, chữ đệm, tên)"
    },
    {
      "heading": "Chú thích (hướng dẫn ghi Tờ khai)",
      "text": "(1) Ghi tên cơ quan giải quyết việc đăng ký hộ tịch; nếu là Ủy ban nhân dân cấp xã thì ghi đủ 03 cấp hành chính (tỉnh, huyện, xã); nếu là Cơ quan đại diện thì ghi rõ tên cơ quan đại diện và tên nước có trụ sở Cơ quan đại diện."
    }
  ],
  "notes": "relevance: tờ khai số 20 trong Danh mục Phụ lục 5 (Tờ khai đăng ký hộ tịch được đăng tải trên Cổng TTĐT Bộ Tư pháp, người dân tự in) dùng cho các thủ tục này. Nguồn: Công báo (congbao.chinhphu.vn), bản Word. Dấu chấm dẫn dòng được rút gọn thành \"…\". Thay thế Phụ lục Tờ khai của Thông tư 04/2020/TT-BTP từ 06/6/2024; chưa kiểm tra mẫu có bị thay đổi sau 01/07/2025 hay không."
}
