{
 "doc_id": "legal:70-2024-ND-CP:dieu-12",
 "kind": "legal_text",
 "title": "Nghị định 70/2024/NĐ-CP, Điều 12",
 "issuer": "Chính phủ",
 "effective_date": "2024-07-01",
 "url": "https://g7.cdnchinhphu.vn/api/download/stream?Url=tm-8mq6BhNw0NbrKRhTDAQWsKg3tuqaY0aWypnY78U6M2BY68Ekp0Gvvr483flbRgoCaQJ4p801_cqaH6fc_0HoYwD-DdGDcXH5jRELCU8vYoqsCz2vD5CF4kWoswD8lWRYrq2zdhVUeIMbASSeuCg~~&file_name=2024_777+%2b+778_70-2024-N%c4%90-CP.doc",
 "retrieved_at": "2026-10-10",
 "sha256": "f0fceda7a2524a4d31d245a85bdccba95251a03f9fb2ec8b9c465641c803c30d",
 "procedure_ids": [
  "2.001178"
 ],
 "sections": [
  {
   "heading": "Điều 12. Xác nhận thông tin số chứng minh nhân dân 09 số, số định danh cá nhân",
   "text": "1. Thông tin số chứng minh nhân dân 09 số, số định danh cá nhân đã hủy được mã hóa, tích hợp trong mã QR trên thẻ căn cước. Cơ quan, tổ chức, cá nhân quét mã QR trên thẻ căn cước và sử dụng thông tin số chứng minh nhân dân 09 số, số định danh cá nhân đã hủy truy xuất được qua mã QR để phục vụ giải quyết thủ tục hành chính, dịch vụ công, các giao dịch và hoạt động khác; không được yêu cầu công dân phải cung cấp xác nhận số chứng minh nhân dân 09 số, số định danh cá nhân đã hủy.\n2. Trường hợp thông tin số chứng minh nhân dân 09 số, số định danh cá nhân đã hủy được cập nhật vào Cơ sở dữ liệu quốc gia về dân cư, cơ quan quản lý căn cước hoặc Công an cấp xã có trách nhiệm xác nhận thông tin số chứng minh nhân dân 09 số, số định danh cá nhân đã hủy khi công dân yêu cầu.\n3. Công dân nộp hồ sơ đề nghị cấp xác nhận số chứng minh nhân dân 09 số, số định danh cá nhân qua Cổng dịch vụ công quốc gia, Cổng dịch vụ công Bộ Công an hoặc Ứng dụng định danh quốc gia hoặc trực tiếp tại cơ quan quản lý căn cước hoặc Công an cấp xã gồm:\na) Phiếu đề nghị giải quyết thủ tục về căn cước;\nb) Giấy chứng minh nhân dân 09 số (nếu có).\n4. Trong thời hạn 03 ngày làm việc kể từ ngày nhận đủ hồ sơ, cơ quan quản lý căn cước hoặc Công an cấp xã nơi tiếp nhận đề nghị có trách nhiệm xác nhận thông tin về số định danh cá nhân đã hủy; số chứng minh nhân dân 09 số đối với trường hợp thông tin số chứng minh nhân dân 09 số đã được cập nhật vào Cơ sở dữ liệu quốc gia về dân cư.\n5. Trường hợp thông tin số chứng minh nhân dân 09 số chưa được cập nhật vào Cơ sở dữ liệu quốc gia về dân cư thì trong thời hạn 07 ngày làm việc kể từ ngày nhận đủ hồ sơ, cơ quan quản lý căn cước hoặc Công an cấp xã nơi tiếp nhận đề nghị có trách nhiệm kiểm tra, xác minh và xác nhận thông tin về số chứng minh nhân dân 09 số.\n6. Kết quả giải quyết thủ tục cấp giấy xác nhận thông tin số chứng minh nhân dân 09 số, số định danh cá nhân được cơ quan quản lý căn cước hoặc Công an cấp xã trả cho công dân bằng văn bản giấy hoặc văn bản điện tử theo nhu cầu của công dân.\n7. Trường hợp từ chối cấp xác nhận thì trả lời công dân bằng văn bản và nêu rõ lý do."
  }
 ],
 "jurisdiction": null,
 "link_method": "legal_basis",
 "notes": "relevance: confirmation of 9-digit ID number / personal ID number. Công báo .doc (congbao.chinhphu.vn/van-ban/nghi-dinh-so-70-2024-nd-cp-42136.htm). Amended by NĐ 58/2026/NĐ-CP (text not held): not merged.",
 "original_version": true,
 "amended_by": [
  "NĐ 58/2026/NĐ-CP"
 ]
}