{
  "doc_id": "legal:04-2020-TT-BTP:dieu-9",
  "kind": "legal_text",
  "title": "Thông tư 04/2020/TT-BTP, Điều 9",
  "issuer": "Bộ Tư pháp",
  "effective_date": "2020-07-16",
  "jurisdiction": null,
  "url": "https://media.lamdong.gov.vn/media/5e84f55c-7065-4e34-abf1-da303dc5302e",
  "retrieved_at": "2026-10-10",
  "sha256": "e8bbce073bc0eca5f6c9148ea56f2976c7f0d476fd011d5cdc9da6db8db055de",
  "procedure_ids": [
    "1.004884",
    "2.000522"
  ],
  "link_method": "legal_basis",
  "original_version": true,
  "amended_by": [
    "09/2022/TT-BTP",
    "04/2024/TT-BTP",
    "08/2025/TT-BTP"
  ],
  "sections": [
    {
      "heading": "Điều 9. Giấy tờ, tài liệu là cơ sở đăng ký lại khai sinh",
      "text": "Giấy tờ, tài liệu là cơ sở đăng ký lại khai sinh theo quy định tại điểm b khoản 1 Điều 26 Nghị định số 123/2015/NĐ-CP gồm:\n1. Bản sao Giấy khai sinh do cơ quan có thẩm quyền của Việt Nam cấp hợp lệ.\n2. Bản chính hoặc bản sao giấy tờ có giá trị thay thế Giấy khai sinh được cấp trước năm 1945 ở miền Bắc và trước năm 1975 ở miền Nam.\n3. Trường hợp người yêu cầu đăng ký lại khai sinh không có giấy tờ quy định tại khoản 1 và khoản 2 Điều này thì giấy tờ do cơ quan, tổ chức có thẩm quyền của Việt Nam cấp hợp lệ sau đây là cơ sở để xác định nội dung đăng ký lại khai sinh:\na) Giấy chứng minh nhân dân, Thẻ căn cước công dân hoặc Hộ chiếu;\nb) Sổ hộ khẩu, Sổ tạm trú, giấy tờ chứng minh về nơi cư trú;\nc) Bằng tốt nghiệp, Giấy chứng nhận, Chứng chỉ, Học bạ, hồ sơ học tập do cơ quan có thẩm quyền cấp hoặc xác nhận;\nd) Giấy tờ khác có thông tin về họ, tên, ngày, tháng, năm sinh của cá nhân.\nNgười yêu cầu đăng ký lại khai sinh có trách nhiệm nộp đầy đủ bản sao các giấy tờ nêu trên (nếu có) và cam đoan về việc đã nộp đủ các giấy tờ mình có; chịu trách nhiệm, hệ quả của việc cam đoan không đúng sự thật theo quy định tại Điều 5 Thông tư này.\n4. Trường hợp giấy tờ của người yêu cầu đăng ký lại khai sinh không có thông tin chứng minh quan hệ cha, mẹ, con thì cơ quan đăng ký hộ tịch có văn bản đề nghị cơ quan công an có thẩm quyền xác minh.\nTrường hợp cơ quan công an trả lời không có thông tin thì cơ quan đăng ký hộ tịch cho người yêu cầu đăng ký lại khai sinh lập văn bản cam đoan về thông tin của cha, mẹ theo quy định tại Điều 4, Điều 5 Thông tư này và xác định nội dung khai sinh theo văn bản cam đoan."
    }
  ],
  "notes": "relevance: đăng ký lại khai sinh: giấy tờ làm cơ sở, xác định nội dung; Thông tư 04/2020/TT-BTP is cited in legal_basis of these procedures (article chosen by topic). Source: văn bản gốc, bản Word do Cổng TTĐT tỉnh Lâm Đồng đăng tải. Hiệu lực/sửa đổi: Văn bản gốc; đã được sửa đổi, bổ sung bởi Thông tư 09/2022/TT-BTP, 04/2024/TT-BTP và Thông tư 08/2025/TT-BTP."
}
