{
  "doc_id": "legal:123-2015-ND-CP:dieu-34",
  "kind": "legal_text",
  "title": "Nghị định 123/2015/NĐ-CP, Điều 34",
  "issuer": "Chính phủ",
  "effective_date": "2016-01-01",
  "jurisdiction": null,
  "url": "https://media.lamdong.gov.vn/media/5e84f55c-7065-4e34-abf1-da303dc5302e",
  "retrieved_at": "2026-10-10",
  "sha256": "e8bbce073bc0eca5f6c9148ea56f2976c7f0d476fd011d5cdc9da6db8db055de",
  "procedure_ids": [
    "2.002189"
  ],
  "link_method": "legal_basis",
  "original_version": true,
  "amended_by": [
    "87/2020/NĐ-CP",
    "104/2022/NĐ-CP",
    "07/2025/NĐ-CP",
    "120/2025/NĐ-CP"
  ],
  "sections": [
    {
      "heading": "Điều 34. Điều kiện ghi vào Sổ hộ tịch việc kết hôn của công dân Việt Nam đã được giải quyết tại cơ quan có thẩm quyền của nước ngoài ở nước ngoài",
      "text": "1. Việc kết hôn giữa công dân Việt Nam với nhau hoặc với người nước ngoài đã được giải quyết tại cơ quan có thẩm quyền của nước ngoài ở nước ngoài được ghi vào Sổ hộ tịch nếu tại thời điểm kết hôn, các bên đáp ứng đủ điều kiện kết hôn và không vi phạm điều cấm theo quy định của Luật Hôn nhân và gia đình Việt Nam.\n2. Nếu vào thời điểm đăng ký tại cơ quan có thẩm quyền nước ngoài, việc kết hôn không đáp ứng điều kiện kết hôn, nhưng không vi phạm điều cấm theo quy định của Luật Hôn nhân và gia đình, nhưng vào thời điểm yêu cầu ghi vào Sổ hộ tịch việc kết hôn, hậu quả đã được khắc phục hoặc việc ghi chú kết hôn là nhằm bảo vệ quyền lợi của công dân Việt Nam và trẻ em, thì việc kết hôn cũng được ghi vào Sổ hộ tịch."
    }
  ],
  "notes": "relevance: ghi vào Sổ hộ tịch việc kết hôn đã giải quyết ở nước ngoài; Nghị định 123/2015/NĐ-CP is cited in legal_basis of these procedures (article chosen by topic). Source: văn bản gốc, bản Word do Cổng TTĐT tỉnh Lâm Đồng đăng tải. Hiệu lực/sửa đổi: Văn bản gốc; đã được sửa đổi, bổ sung bởi Nghị định 87/2020/NĐ-CP, 104/2022/NĐ-CP, 07/2025/NĐ-CP và thẩm quyền được phân định lại theo Nghị định 120/2025/NĐ-CP (từ 01/07/2025)."
}
